,job_descn
25,"Roles & Responsibilities Develop, maintain and enhance key elements of the  strategy and policy—to be applied by business and process owners—including risk and control self-assessment framework, scenario analysis, risk event management, issue management, monitoring and reporting Collaborate with business/process owners and business unit controllers to prioritize and apply Policy standards Serve as a liaison and subject matter expert with controllers, business and process owners on risk identification and assessment, as well as control identification, assessment and monitoring; recommend practical alternatives for risk mitigation and process improvement Create a culture of risk awareness across the organization by developing and implementing communications and training strategies to drive s strong control environment and accountability for risk management Develop, implement and maintain process to aggregate risk events and issues across business functions to identify and analyze themes, trends and control gaps Develop data-driven, risk-based insights and management reporting to support business decisions at senior, executive and Board levels Requirements Strong leader and strategic thinker Expertise in risk management frameworks gained through operations, business advisory and/or audit roles is preferred Ability to develop and implement strategy to meet corporate objectives and provide insights to executive management Experienced risk manager with extensive program management experience Broad exposure to business risks across IT, finance and other business environments is essential Consultative mindset and reputation for being a strong business partner Background in telecommunications or payments industry preferred Ability to effectively interact and influence people at all levels Global work experience and capacity to manage tasks across multiple regions, cultures and time zones Excellent oral, written and presentation skills Demonstrated process and project management capabilities "
26,"Roles & ResponsibilitiesOur Account Manager will manage the client engagement, contract deliverables and planning whilst delivering reports, insights and strategic guidance. We need an enthusiastic and clear communicator, an independent thinker and a customer centric individual who is capable of multitasking. Partnering with the Head of Growth (Business Development) you will translate the client’s requirements into a comprehensive project plan which you will own. As the client evangelist, you will provide clarity and visibility for the internal teams to ensure all milestones are understood and achieved. Using your strong client relationships you will help colleagues build effective relationships at every level within the client’s organisation to promote Sparkline’s value across their business. THE PERSON: As a reputable problem solver you will use your big picture ideas and effective communication skills to help the team remove roadblocks to success. Possessing knowledge and passion for the digital space, you will be in a position to understand the client’s landscape and potential problems to solve. You will establish yourself as a recognised business partner, with an in-depth knowledge of your client’s business utilising your digital/data analytics experience. You will be able to anticipate, address and escalate any client issues to ensure the client and Sparkline’s management team are aware. In turn, this unique perspective will allow you to identify new areas of interest and value added opportunities to expand our relationship with the customer.RequirementsYOU WILL BRING: ● 5+ years experience in key account management or customer service is essential and preferably across a Digital domain ● Ideal experience would be 3+ years project management experience in a consulting firm, publisher or media buying agency ● Previous experience in sales-related/commercially focused role is essential to success in this role ● A must have would be a passion for digital marketing with a solid understanding of interactive marketing channels (search, online media, website development, etc.) and brand marketing principles. ● Knowledge of the main channels of online acquisition: search engines (SEO, SEM, bid-management tools), display, email marketing, e-commerce, social media (Facebook, Twitter, YouTube, etc..) AdExchange, mobile Internet, smartphones applications or tablets, etc.. ● Excellent verbal, written and visualization skills. Able to create, concise, professional documents and comfortable presenting analysis and insights to stakeholders and clients at all levels. ● Strong work ethic with the ability to adapt to the situation; flexible and nimble in terms of work planning and able to think on your feet to resolve issues. ● A capable brand ambassador for Sparkline. An energetic self-starter, excited about the opportunity to make this role their own. ● A team player with a proven track record engaging cross-functional teams to go above and beyond. ● A ‘can do’ work ethic and enthusiasm for continuous learning in the digital space."
27,"Roles & Responsibilities• Design of mechanical seal support systems • Preparation of Piping & Instrumentation Diagrams (P&ID), General Arrangement Drawings (GAD) & Bill of Materials & drawings for pressure vessels, pipe spool & skid fabrication, weld map & fitment, piping isometric & electrical wiring diagrams • Review of technical specifications and preparation of Technical Offer • Documentation of all design calculations, systems drawings, documents issue & control • Hands on experience of using Solid Edge CAD software • Solid Edge-CAD package customization & library creation for 3D part, sub-assemblies & main assemblies. • Preparing of basic design, process flow design, piping and instrumentation diagram, technical specification, instrument and equipment data sheets, wiring diagram and operating philosophy. • Selection of Instruments, electrical and instrument cables, junction box and other wiring accessories • Reviewing of process and safety requirements • Managing existing vendors and developing new vendors • Undertaking Site surveys to understand customer issues • Installation / commissioning of equipments at site • Any other duties as may be assigned by supervisor from time to time.Requirements• Engineering Degree in Mechanical / Instrumentation / Electrical / Electronics Engineering.  • 2 to 4 years of experience with Systems design. • Experience in Installation and Commissioning of equipments in Refineries / Petrochemical plants will be an advantage. • Should be familiar with Sold Edge CAD software or have aptitude to learn the software • Should have good experience in preparing Data sheets for Instruments and Equipments. • Should be familiar with Mechanical requirements of piping, equipments and related ASME Standards • Good hands on experience in MS Office - MS Word, Excel and power point • Self driven, good communication skills, presentation skills & a good team player. • Willing to travel for discussions with the Customer, attending site issues etc • Experience in designing full-fledged integrated Dry Gas Seal Systems • Experience in handling projects"
28,"Roles & Responsibilities Maintain established files in accordance with internal procedures Travel arrangements Meeting arrangements Managing invoice, PO via online system Managing data and reporting Assist in internal events - Townhall Provide administrative support to HR Handle other administrative duties as assigned Requirements Diploma or any related discipline with at least 1 year of experience Self motivated with the ability to work independently and in a team Possess high self-esteem, high tolerance for straight forwardness and highly receptive Meticulous and good in coordination Other ad-hoc duties assigned from time to time "
29,"Roles & ResponsibilitiesA full-time Research Fellow position is available in handling research and administrative duties to the principal investigator in Virtual Singapore project. Major duties and responsibilities:  To undertake research and evaluate outcomes based on the research objectives and plans. Plan, coordinate and implement research programmes in accordance with university strategy, policy and procedures and funder requirements Performing data analytics. Writing or contributing to publications or disseminating research findings using media appropriate to the discipline. Make presentations at conferences or exhibit work at other appropriate events. Assess, interpret and evaluate outcomes of research. Develop new concepts and ideas to extend intellectual understanding. Resolve problems of meeting research objectives and deadlines. Lead or guide the work of research assistants and student helpers. Mentor colleagues with less experience and advise on professional development. Coach and support colleagues in developing their research techniques. Supervise the work of others, for example in research teams or projects. Attend project meetings. Attend area seminars and other meetings as necessary. Prepare progress reports. Prepare other articles, reports and presentations. Participate in administrative work and tasks.  Kindly send the CV to Prof Wong Nyuk Hien (bdgmarc@nus.edu.sg).RequirementsThe applicant would preferably be a qualified PhD degree from a relevant field, particularly urban climate, urban 3D modelling (CityGML), and simulation (climate and energy). Experience, expertise, and knowledge in urban heat island, climate change, energy modelling, and performance analytics are essential. Basic skills in 3D modelling or parametric (SketchUp, Rhino, Grasshopper, etc), statistical software (SPSS, Matlab), and programming/coding (Python) would be an added advantage. Familiarity with Microsoft Office Applications (MS Word, Excel, and Power point), Building Information Modelling (BIM) and Geographic Information System (GIS) would be useful. The successful candidate will be engaged in Virtual Singapore (VSg) Phase II project, in which related with macro and microclimate analysis in both urban and building scale."
30,"Roles & ResponsibilitiesWe are looking to hire an senior onsite recruiter for one of our banking client in SG! The key focus for the Recruiter is to lead the successful fulfilment of open vacancies with relevant hiring managers and to be the first point of contact for their hiring needs of the retail banking portfolio.  Your duties may include, but are not limited to:   • Undertaking recruitment activities with a focus on direct sourcing.  • Understanding the recruitment delivery process and carrying out activities accordingly to ensure that account KPIs are met.  • Communicating recruitment trends, market intelligence, and acting as a Talent Advisor to hiring managers.    • Identifying and escalating risk or compliance issues.  • Managing requisitions through accurate documentation of all recruitment related data and information as per current recruitment legislation and agreed client process at all times.  • Providing recruitment guidance and advice to the Recruitment Sourcing Specialists and Recruitment Coordinators located in the Recruitment Delivery Center.  • Monitoring and analyzing recruitment activity of designated business area for accurate volume forecasting.    • Coaching candidates on how to prepare for selection stages.  • Providing professional advice and open and honest feedback to candidates in a timely manner and in accordance with recruitment best practice.    • Utilizing specialist market knowledge to assist with the development and on-going management of pre-qualified Talent Pools in collaboration with the Recruitment Sourcing Specialist.  Requirements Prior experience in end-to-end recruitment within the staffing industry or Corporate HR, preferably with a global organization. High volume of recruitment experience is a must Prior experience conducting behavioral based interviews for a variety of roles.  Successful experience managing multiple searches, and stakeholders, at different stages of the recruitment lifecycle at the same time. Excellent communication and interpersonal skills.  Functional knowledge of Microsoft Office.  Prior experience in using an Applicant Tracking System (ATS).  Ability to write client oriented communications e.g. emails, job descriptions.  Tertiary qualification in business or a related discipline is highly desirable. Bachelor’s degree preferred "
31,Roles & ResponsibilitiesThe Job  Analysing and grading large sets of data relevant to specific markets Investigating and providing feedback on issues reported Validating and correcting data from external sources RequirementsThe Talent  Min degree/diploma in any discipline. Strong web analytical and problem solving skills Hands on experience on quantitative analysis are required. Outstanding relationship building and problem solving skills. Required to have good geographical knowledge and the written local language of Korea 
32,"Roles & Responsibilities Develop and implement One Animation’s content strategy for YouTube in order to drive traffic, audience engagement, retention, and revenue growth, as per assigned KPIs. Manage the content production and editorial calendar. Keep track of all tasks, workflows, and deadlines. All aspects of day-to-day channel management and content curation, including content uploading and scheduling, refreshing playlists and key channel areas, as well as overall channel optimization and best practices. Create YouTube video compiles using existing available videos assets, as well as other relevant YouTube assets such as thumbnails, cards, end screens, etc. Write, edit, and manage loglines, descriptions, and other required elements for the platform. Create and apply all relevant metadata and tags to channels and content; ensure metadata is consistent with Brand, and optimized for search and user experience. Liaise with in-house Production and Creative teams to source all relevant video and graphic assets. Source multi language translation for localized channels: liaise with relevant internal and external parties. Liaise with Marketing team to support strategic content marketing initiatives. Liaise with Social Media & Community Managers to better understand our audience and their direct feedback. Analyze and track content performance vs KPIs; identify and map out new ways to repurpose content in order to maximize discoverability and increase reach and viewership. Continue to refine the content strategy based on performance metrics. Liaise with Content Analyst and present YouTube-specific insights and trends to the broader team (through regular reporting as well as deep dive presentations). Create and implement relevant tracking/blocking/monetization policies on YouTube’s Content ID. Liaise with Legal team with regards to content claiming and content takedowns. Any other task relevant to the role, as required.    Job Requirements:  2+ years of experience in YouTube channel management and 4+ years of relevant experience in creating content that builds audience engagement and increases reach. Proficient in content management systems, video publishing, live streaming, and digital analytics tools. Comprehensive knowledge of YouTube’s CMS and Content ID; comfortable with interpreting data from Google Analytics. Able to identify, analyze, and interpret trends or patterns in complex data sets. Demonstrated personal management skills such as setting priorities, managing time, decision making, and multitasking. Excellent written and oral communications skills and a team-oriented work ethic. Strategic thinking and creative problem-solving skills. Entrepreneurial instincts and a can-do attitude. Eye for the big picture, but also an enjoyment of hands-on, day-to-day operations. Multi-language skills (i.e. Spanish, French, and Portuguese) in order to manage localised channels. Detail-oriented: meticulous attention to detail.     RequirementsDesirable:  Adept to Change: Comfortable in an evolving startup environment and can embrace and adjust to change with enthusiasm and focus. Organized: Can manage multiple operational tasks simultaneously, focusing effort based on priorities and leadership direction, and able to deliver results with a consistent approach. Thrive under deadline pressure. A creative flair. Familiar with Oddbods and other One Animation shows.      "
33,"Roles & Responsibilities Coordinate, evaluate patients who fall within the research study recruitment.  Consent patients, collect samples from patients and follow-up with clinical data.  Clinical data safe keeping.  Project planning with research team.    RequirementsQualification:   Bachelor in science-related field, nursing or equivalent degree  Experience:   Previous experience as a research coordinator/ nurse will be an added advantage.   Skills:   Phlebotomy skills is preferred  Interested applicants are invited to email a detailed resume stating your current and expected salary to alliedhealth@nuhs.edu.sg Please indicate in the subject title as: ""Applying for position of Clinical Research Coordinator (Contract)_O&G Department” We regret that only shortlisted candidates will be notified."
34,"Roles & ResponsibilitiesThe Marketing Manager contributes to the realisation of the organisation's business strategies by driving its marketing and public relations programmes. He/She is also responsible for directing the organisation's communication plans, generating data-driven commercial insights and monitoring budgets. The Marketing Manager works in a fast-paced, dynamic and digitally-centric environment where he/she is expected to lead the development of appealing marketing concepts to promote the organisation and its products. The Marketing Manager is an innovative, energetic, collaborative and highly adaptable team leader. He/She is digitally-savvy and possesses a strong business acumen with a high level of initiative and capacity to work under high pressure.Requirements ~ Analyse new market trends, business opportunities and market segments in global and local landscape. ~ Analyse past performance of collections, categories and campaigns to improve marketing effectiveness and ROI. ~ Assess effectiveness of public relations communication programmes. ~ Define marketing performance measurements in alignment to marketing objectives and strategies. ~ Develop content for online platforms. ~ Develop crisis management action and communication plan. ~ Develop expense forecast and budget allocations. ~ Develop marketing campaigns across offline, digital and social media platforms. ~ Develop website traffic and/or inbound marketing plan. ~ Evaluate end-to-end customer experience across offline and digital platforms and customer touch points. ~ Generate ideas and strategies based upon data-driven insights and recommendations. ~ Manage creative concept of marketing campaigns and communications materials. ~ Manage crisis management communication plans. ~ Manage internal and external communication platforms and channels. ~ Manage offline (traditional) media channels. ~ Manage organization and/or brand reputation. ~ Manage public relations activities. ~ Manage social media platforms. ~ Monitor implementation of marketing campaign. ~ Plan and manage roadshows, promotions and events."
35,"Roles & ResponsibilitiesThe Agency for Science, Technology and Research (A*STAR) is Singapore's lead public sector agency that fosters world-class scientific research and talent to drive economic growth and transform Singapore into a vibrant knowledge-based and innovation driven economy.  For more information about A*STAR, please visit: www.a-star.edu.sg - Be part of a taskforce to support and contribute to the Smart Manufacturing Group (Industry 4.0) vision for the centre - Design and build prototypes, products and systems suitable for testing and set up on Model Factory test bed - Technical planning, execution and delivery of development projects for global industry members - Writing of technical reports and presentation of technical result - Design overall automation solution including system engineering, maintenance and upgrade plans, network architecture and software application - Implementation of security and data protection - Ensure continuity of essential compute, network and storage services - Oversee a robust backup strategy including verification of its efficacy - Administer physical servers and an OpenStack virtualization platform - Direct and execute maintenance of physical and virtual systems with zero-downtime as a baseline - Support the integration of new, cutting-edge software and hardware, with a focus on industrial manufacturing - Manage and track both core and peripheral assets of the infrastructureRequirements Bachelor in Engineering or Computer Science 5 years experience with automation system 5-10 years experience in IPv4 and IPv6 networking, L2 and L3 protocols including VLAN and relevant security/firewalling Strong leadership skills and the ability to work with others to achieve project goals A desire to learn new technologies, and help others to develop their knowledge to work together effectively  The above eligibility criteria are not exhaustive. A*STAR may include additional selection criteria based on its prevailing recruitment policies. These policies may be amended from time to time without notice. We regret that only shortlisted candidates will be notified."
