,job_descn
36,"Roles & ResponsibilitiesCyber threats, social media, massive data storage, privacy requirements and continuity of the business as usual require heavy information security measures. As an information security specialist, you will lead the implementation of security solutions for our clients and support the clients in their desire to protect the business.   The opportunity You will belong to an international connected team of specialists helping our clients with their most complex information security needs and contributing toward their business resilience. As a cybersecurity consultant, you will work with a team of cyber security experts to implement security solutions for our clients and support the clients in their desire to protect the business. You will belong to an international connected team of specialists helping our clients with their most complex information security needs and contributing toward their business resilience. We will support you with career-long training and coaching to develop your skills. As EY is a global leading service provider in this space, you will be working with the best of the best in a collaborative environment. So whenever you join, however long you stay, the exceptional EY experience lasts a lifetime. This is a role where no two days are the same – so you’ll find yourself taking on plenty of new responsibilities as you go. You’ll work alongside clients and colleagues, balancing your time between developing security strategies, advising stakeholders, providing workshops and supporting business development. If you’re flexible and ready to adapt to a constantly changing environment, there’s no better place to develop your skills. Since you’ll be working directly with clients, some travel will be required.RequirementsSkills and attributes for success  Perform security assessments for clients through attack and penetration (primarily network penetration testing, web application vulnerability assessment and source code security review) Evaluate and analyze threat, vulnerability, impact and risk to security issues discovered from security assessments Advise clients on the security issues, including explanation on the technical details and how they can remediate the vulnerabilities in the systems. Perform research on latest threats and vulnerabilities as part of the Ernst & Young Global Advanced Security Centers (ASCs) initiative. Consistently deliver quality client services and manage expectations of client service delivery. Drive high-quality work products within expected timeframes and on budget. Monitor progress, manage risk and ensure key stakeholders are kept informed about progress and expected outcomes. Stay abreast of current business and industry trends relevant to the client's business. Develop and maintain long-term relationships and networks with clients and internal EY stakeholders Demonstrate deep technical capabilities and professional knowledge. Possess in depth business acumen and demonstrate ability to quickly assimilate to new knowledge. Perform penetration testing on SCADA/ICS/IOT systems Review and assess security controls associated with SCADA, ICS and IOT systems Advice clients on cyber security guidelines and best practices Remain current on new developments in advisory services capabilities and industry knowledge.     To qualify for the role you must have   A recognized university degree in Computer Science, Computer/Electrical Engineering, Information Technology or equivalent.   Have at least one year of relevant working experience with implementation or deployment ICS/SCADA/IOT systems   Knowledge in penetration testing, programming, networks and operating systems would be an added advantage   Strong interest in the field of cyber security in industrial control systems and internet of things.   Creative, independent with good problem solving skills   Strong analytical, interpersonal, communication and writing skillWillingness to travel on overseas assignment as the need arises   Ideally, you’ll also have   Professional certifications such as Offensive Security Certified Professional (OSCP), Global Industrial Cyber Security Professional (GICSP), GIAC Penetration Tester (GPEN), Certified Information Systems Auditor (CISA) and / or Certified Information Systems Security Professional (CISSP) will have higher standing.   Preferably at least one year of relevant working experience in cyber security in ICS/SCADA/IOT systems     What we look for Highly motivated individuals with excellent problem-solving skills and the ability to prioritize shifting workloads in a rapidly changing industry. An effective communicator, you’ll be a confident team player that collaborates with people from various teams while looking to develop your career in a dynamic organization.   What working at EY offers We offer a competitive compensation package where you’ll be rewarded based on your performance and recognized for the value you bring to our business. We also offer you:   Support, coaching and feedback from some of the most engaging colleagues around   Opportunities to develop new skills and progress your career   The freedom and flexibility to handle your role in a way that’s right for you     About EY As a global leader in assurance, tax, transaction and advisory services, we’re using the finance products, expertise and systems we’ve developed to build a better working world. That starts with a culture that believes in giving you the training, opportunities and creative freedom to make things better. Whenever you join, however long you stay, the exceptional EY experience lasts a lifetime. And with a commitment to hiring and developing the most passionate people, we’ll make our ambition to be the best employer by 2020 a reality.   If you can confidently demonstrate that you meet the criteria above, please contact us as soon as possible. Join us in building a better working world. Apply now."
37,"Roles & ResponsibilitiesJob Description  Oversee the development of game production from concept to live online operations (end to end) Experienced in managing a diverse team of artists, game designers, programmers and external vendors Collect estimates from design, art, programming, and QA leads to generate project schedules and set release dates Run daily meetings to ensure all tasks are on track Collaborate with team leads to ensure that all deadlines are being met and alleviating dependencies that block development Review schedules with management and team leads, defining what is expected in each milestone/sprint Provide regular reports on the game’s performance and make recommendations & adjustments Analyze data metrics and recommend improvements to the product in order to  improve the revenue model, marketing, new user acquisition, and existing user retention RequirementsQualifications:  Minimum Degree/diploma in a related field Minimum. 8 years of relevant experience, with 2 published titles Possess great communication and presentation skills Possess the leadership skills to lead a team of 12 or more staff Have a strong interest in social games    Skills:  Proven ability to identify, understand, prioritize, plan and articulate market & customer requirements Strong analytic skills and experience with metrics driven decision making A passionate, performance-driven individual with a strong business acumen Leadership, ability to work as part of a team and establish relationships with other departments Ability to adapt and to manage changes Reliability, ability to work under tight deadlines "
38,"Roles & ResponsibilitiesCompany overview: Google is not a conventional company, and we don’t intend to become one. True, we share attributes with the world’s most successful organizations – a focus on innovation and smart business practices comes to mind – but even as we continue to grow, we’re committed to retaining a small-company feel. At Google, we know that every employee has something important to say, and that every employee is integral to our success. We provide individually-tailored compensation packages that can be comprised of competitive salary, bonus, and equity components, along with the opportunity to earn further financial bonuses and rewards. Googlers thrive in small, focused teams and high-energy environments, believe in the ability of technology to change the world, and are as passionate about their lives as they are about their work. For more information, visit www.google.com/careers. The area: People Operations Great just isn't good enough for our People Operations team (you probably know us better as ""Human Resources""). Made up of equal parts HR professionals, former consultants and analysts, we're the champions of Google's colorful culture. In People Ops, we ""find them, grow them, and keep them"" - we bring the world's most innovative people to Google and provide the programs that help them thrive. Whether recruiting the next great Googler, refining our core programs, developing talent or simply looking for ways to inject some more fun into the lives of our Googlers, we bring a data-driven approach that is reinventing the human resources field. The role: Talent Programs and Events Specialist - Singapore Google is known for our innovative technologies, products and services — and for the people behind them. The Google People Services (GPS) team focuses on providing an amazing experience to past, present and future Googlers. As a Programs Specialist, you will enthusiastically represent the Google brand and build our talent pipeline. Whether it’s making our staffing systems more efficient, planning for our growth, building relationships on college campuses or cultivating the next generation of computer scientists, you will have an eye on the staffing needs of Google and the broader hiring landscape. You'll be focused on cultivating outstanding candidates for Google's long-term hiring needs, and you are the glue that ties together a cross-functional and international group of staffing teams. Additional Role Description: The Talent Programs and Events team, part of GPS, is focused on promoting Google as an exceptional place to work for experienced talent, building a robust and diverse pipeline of outstanding candidates, and collaborating cross-functionally and globally to build and refine partnerships and outreach. Whether you are developing events that will engage a target talent profile, building relationships with external organizations, or developing strategies to attract talent to Google’s workforce, you will have an eye on Google’s short- and long-term growth needs and a pulse of the broader brand landscape. You will partner with various Staffing and Product Areas to build a comprehensive outreach strategy from the ground up and ensure perfect execution. Responsibilities: - Develop and execute events and programs for external candidates, track results and scale where possible. Partner with internal entities to create comprehensive program and event strategies. - Plan and execute recruiting and employment branding events, ranging from small intimate programs to large scale productions. - Manage relationships with key external organizations and groups to cultivate a partnership and enhance Google’s brand in the employment marketplace. - Develop and implement events, including program mapping and planning, budgets, stakeholder buy-in, logistics, messaging, developing content with Googlers, and other core elements to successfully meet event objectives. Contribute to the online presence and public messaging by creating interesting and informational web and collateral content. - Build relationships with vendors, internal team members, and a wide range of stakeholders across Google to manage expectations and ensure high-quality event management.RequirementsMinimum qualifications: - Bachelor's degree or equivalent practical experience. - 5 years of experience in program/event planning, recruiting, marketing, HR, consulting or a related area. - Ability to travel up to 50% of the time. Preferred qualifications: - Ability to focus on providing top-quality client support for the coordination and seamless delivery of events. - Ability to prioritize and complete multiple tasks, and follow through with team members to achieve group and individual goals. - Willingness to roll up your sleeves and get the job done. - Demonstrated project and budget management and organizational skills. - Excellent relationship management skills, including negotiation, influencing, and interpersonal communications."
39,"Roles & ResponsibilitiesGQ - NVMQRA SENIOR / ENGINEER (RMA) As a Non-Volatile Memory Quality & Reliability Assurance (NVMQRA) Engineer at the Company, you will be responsible for performing formal Failure Analysis of customer reported failing devices via the Returned Material Authorization (RMA) process. You will be required to summarize lab analysis results at the electrical and physical level to identify root cause and establish an associated containment plan. In this role, you will have the opportunities to collaborate with various engineering and manufacturing stakeholders to evaluate and review Corrective Actions /Preventive Actions. You will provide documentation of the RMA findings and oversee the final customer report till closure. In addition, for the senior role, you will be asked to provide guidance and lead the team when solving complex unplanned deviations reported by our customers. Project management skills are necessary and the ability to make critical decisions that directly translate to quality and timely completion of the project is highly desirable. You will also be required to spearhead the sustaining efforts and keeping up to date on new product knowledge, as well as developing and mentoring new talents.   Responsibilities and Tasks Perform Failure Analysis of Customer Returns  Understand customer complaint of the memory component failure Initiate communication with the Company Customer-facing team for further details on customer complaint, requesting additional questions to provide best opportunity for successful analysis Perform bench level analysis including initial data image analysis/examination Perform Automated Test Equipment (ATE) analysis and interpret results Work with the appropriate engineering teams (e.g., PE, PYE) to perform detailed fault isolation when electrical failure has been confirmed Summarize findings and submit for physical failure analysis (PFA).  Provide FA Reports for the Company Customer Facing Team for Communication to Customers  Summarize analysis at electrical and physical level into customer friendly formats. Work with the appropriate manufacturing Global Quality teams through the appropriate request systems (example: GDMS) for Root Cause and/or Corrective Action and a containment plan Identify potential risk to external customers Communicate with respective BU (Business Unit) on potential impact to customers Communicate FA updates through interim reports or during scheduled meetings with the customers. Provide formal FA Report with findings    Sustain Knowledge of Device Capabilities and Characteristics  Keep up to date with latest Wafer Fabrication and Package Assembly process technology Understand datasheet specifications for each device. Comprehension of qualification data and potential impact to customer operation Stay up-to-date on common customer system applications and usage model Partnering with customer support team to resolve ongoing customer issues RequirementsQualifications and Experience  Excellent verbal and written communication skills. The ability to communicate clearly and concisely both verbally and in writing is critical in this role. Good organization skills and ability to multitask and coordinate between multiple issue at any given time. Ability to work effectively in cross-functional teams and handle pressure situations in a professional manner Excellent problem-solving and analytical skills with strong attention to details. Familiarity with NexTest /Teradyne bench analytical tools, scripting in linux console will be an added advantage.      Candidates with 2-3 years of experience in the semiconductor industry as Product or QA engineer are preferred. Relevant experienced candidates will be considered for the Senior Role.  Education A Bachelor or Masters Degree in Electrical Engineering or similar field of study."
40,"Roles & Responsibilities  What You'll Do As a Data Scientist, you will:   • Be the Problem-solver and be the catalyst that will help business teams make better decisions using Data and Analytics • Bring to the table an inter-disciplinary skillset of Applied Math, Technology and Business • Develop Data Products/Services across Descriptive, Inquisitive and Prediictive Analytics to improve business processes and drive tangible business outcomes • Design, build, and operationalize models using the latest in AI/ML techniques to build relevant solutions • Lead complex analytics programs, working with cross-functional teams • Coach and mentor other Data Scientists  • Above all, come with a curious mind and a passionate learning mindset Who You'll Work With Join us at Data and Analytics : we are building a world-class team of passionate, result oriented problem solvers with the aim of enabling better data-driven decisions and thereby creating business impact.  We operate as a startup: work hard, learn every day, focus on doing measurable and impactful work; and have lots of fun along the wayRequirementsWho You Are • Thrive in a multi-tasking, rapid prototyping, and agile development environment Our minimum requirements for this role:  • BS in math, statistics, data science, computer science, engineering, or economics • Minimum 8-10 years related analytics/data science experience • 2+ years experience in a data scientist role doing machine learning, predictive models, artificial intelligence, deep learning, preferably with some of that at a B2B company • Experience with data warehousing and data Integration  tools • Experience with Teradata, Hadoop, Hive, Spark, SAP HANA • Advanced or expert level in SQL, R, Python • Experience with visualization tools, e.g. Tableau or Qlik • Strong communication skills • Ability to draw conclusions from data and recommend actions"
41,"Roles & Responsibilities Creating ETL mappings to extract data from multiple legacy systems;  Transforming and loading the data into the Enterprise Data Warehouse using Informatica; . Developing complex ETL programs using Informatica Power Center Transformations such as Informatica Aggregator, Sorter, Router, Filter, Joiner, Lookup, mapplet, SQL transformation, Stored Procedure and other transformations;  Setting up batches and work flow sessions to run these mappings;  	Designing Informatica mappings and data model structural changes;  	Designing and creating transformer models;  Developing and optimizing complex SQL programs and writing SQL queries, stored procedures, database triggers, cursors, database constraints, in-line views, PL/SQL records and tables;  Understanding business challenges and translating them into process/technical solutions;  Creating documents related to the ETL process; and  	Producing change control documentation.  Requirements Required experience in the development, implementation, and maintenance of Informatica applications. Preferred Other database design, development, and normalization using Oracle DBMS or Microsoft SQL Server.  EA License no.: 13C6338 I Reg no.: R111035"
42,"Roles & ResponsibilitiesXaxis is an agency of GroupM, the world’s largest media investment company and are a part of WPP. In fact, we are responsible for one in every three ads you see globally.   We are currently looking for a Senior Manager to join the Programmatic Trading team for Xaxis Singapore. The Programmatic Trading team at the heart of all Xaxis activity, and is pivotal to the success of each campaign that is executed. We work in a close-knit pod structure to support our clients. We are looking for someone with a positive attitude, enthusiastic and is able to think out of the box and do better with each execution. At GroupM APAC, our people are our strength, which is why fostering a culture of diversity and inclusion is important to us.  Reporting of the role  This role reports to the Client Services Director.  3 best things about the job:  It’s a great work environment - You will collaborate with a group of quick witted, humorous, diverse and extremely dedicated colleagues who are all passionate about programmatic and making advertising welcome. Opinions and ideas are highly encouraged, and everyone has a voice at Xaxis. Ambition is expected and passion is admired. We are always open to new ways of thinking from everyone, especially those that will contribute to the overall success of Xaxis. It is never static. You are empowered to create your own balance and be proactive. There is always something new to learn, new challenges to overcome, and new technology to embrace everyday.  Measures of success – In three months:  Gain an in depth understanding of the programmatic landscape, be trained on the various Xaxis platforms and tools and have an understanding of how Xaxis operates Incorporate and recommend other aspects of the Xaxis business including audience planning and insights, Xaxis products and Xaxis Marketplace as part of the overall campaign strategy and execution Develop relationships and earn trust with your own team as well as the local market operation teams   In six months:  Work with the Engagement Team to grow key accounts’ businesses from the trading perspective Develop and identify gaps/processes/tools to improve campaign performance and efficiency  In twelve months:  Be involved with strategic planning with Engagement team and Agency Run more effient campaigns  Responsibilities of the role: Day to day responsibilities:  Be a part of a team that works together with Engagement team to support and manage programmatic campaigns across all Xaxis products Work with Engagement team on pre-campaign planning Manage the end to end process from brief through to set up, tagging checks and optimization to ensure report metrics are fully captured Strategize and execute campaigns on our platform and ensure optimal delivery and performance Analyze campaign data to develop insights and strategies for campaign optimization Provide in-depth campaign insights and optimization recommendations for campaign improvement  Strategic Responsibilities:  Bridge the gap between sales (Engagement) and Trading Provide guidance to junior members of the team Be able to drive strategic conversations with agency and client on next steps for the benefit of the campaigns Become a trusted advisor and expert within the programmatic trading field Take an active role in developing broader programmatic strategic recommendations and best practices that can be applied      About Xaxis Xaxis is a global digital media platform that programmatically connects advertisers to audiences across all addressable channels. Through the expert use of proprietary data and advertising technology along with unparalleled media relationships, Xaxis delivers results for over 2,800 clients in 40 markets across North America, Europe, Asia Pacific, Latin America and the Middle East. Advertisers working with Xaxis achieve exceptionally high return on advertising spend through the company’s proprietary media products, as well as through its wholly-owned specialist companies, Light Reaction, Bannerconnect, and ActionX.  For more information, visit www.xaxis.com. About Singapore GroupM Singapore operates in one of the most dynamic and exciting environments in the world. Although it is a small domestic market, there is a vibrant media industry which is undergoing rapid evolution as digital technology reshapes the way marketing supports advertisers’ needs. Being at the crossroads of Asia means that aside from the local clients and media owners, we also have a high proportion of multi-national clients and media owners. As the largest media investment management company in Singapore with over 41% market share (Recma) and over 650 employees, GroupM Singapore is the premiere organisation to join and develop a career in. GroupM APAC is committed to fostering a culture of diversity and inclusion. Our people are our strength so we respect and nurture their individual talent and potential.RequirementsWhat you will need:  5-6 years professional experience in a related field with hands on campaign optimization and account management experience Bachelors degree in marketing, communications or a related field Hands on experience and knowledge in programmatic trading Deep understanding of DSPs/SSPs, RTB, ad exchanges, DMPs, audience targeting Experience in campaign implementation, optimization and reporting, experience with response driven/demand generation campaigns Experience in managing and dealing with multi-markets across APAC Understanding of the digital media ecosystem and technology including ad tagging and site analytics Knowledge and passion for digital marketing: digital display, digital branding, digital direct response, SEM, video & mobile Must be able to work in a fast paced environment - harvest vast amounts of information, news, data, and research and distill the most important/relevant information for your agency team and their clients. "
